{
  "$schema": "http://json-schema.org/draft-07/schema#",
  "$id": "urn:lenskit:schema:architecture.graph.v1.schema.json",
  "title": "Architecture Graph (architecture.graph v1)",
  "type": "object",
  "additionalProperties": false,
  "required": ["kind", "version", "run_id", "canonical_dump_index_sha256", "nodes", "edges", "coverage"],
  "properties": {
    "kind": { "type": "string", "const": "lenskit.architecture.graph" },
    "version": { "type": "string", "const": "1.0" },
    "run_id": { "type": "string" },
    "canonical_dump_index_sha256": { "type": "string", "pattern": "^[a-f0-9]{64}$" },
    "generated_at": { "type": "string", "format": "date-time" },
    "granularity": { "type": "string", "enum": ["file", "package", "module"] },
    "nodes": {
      "type": "array",
      "items": {
        "type": "object",
        "additionalProperties": false,
        "required": ["node_id", "kind", "path", "repo", "is_test"],
        "properties": {
          "node_id": { "type": "string" },
          "kind": { "type": "string", "enum": ["file", "package", "module", "external"] },
          "path": { "type": "string" },
          "repo": { "type": "string" },
          "language": { "type": "string" },
          "layer": { "type": "string" },
          "is_test": { "type": "boolean" },
          "size_bytes": { "type": "integer", "minimum": 0 }
        }
      }
    },
    "edges": {
      "type": "array",
      "items": {
        "type": "object",
        "additionalProperties": false,
        "required": ["src", "dst", "edge_type", "evidence", "evidence_level"],
        "properties": {
          "src": { "type": "string" },
          "dst": { "type": "string" },
          "edge_type": { "type": "string", "enum": ["import", "require", "config-link", "string-ref", "call-heuristic"] },
          "evidence_level": { "type": "string", "enum": ["S0", "S1", "S2"] },
          "evidence": {
            "type": "object",
            "additionalProperties": false,
            "required": ["source_path"],
            "properties": {
              "source_path": { "type": "string" },
              "start_line": { "type": "integer", "minimum": 1 },
              "end_line": { "type": "integer", "minimum": 1 },
              "extract": { "type": "string", "maxLength": 240 }
            }
          }
        }
      }
    },
    "coverage": {
      "type": "object",
      "additionalProperties": false,
      "required": ["files_seen", "files_parsed", "edge_counts_by_type", "unknown_layer_share"],
      "properties": {
        "files_seen": { "type": "integer", "minimum": 0 },
        "files_parsed": { "type": "integer", "minimum": 0 },
        "edge_counts_by_type": { "type": "object" },
        "unknown_layer_share": { "type": "number", "minimum": 0, "maximum": 1 }
      }
    }
  }
}
