{
  "kind": "lenskit.architecture.graph",
  "version": "1.0",
  "run_id": "test_run_123",
  "canonical_dump_index_sha256": "0000000000000000000000000000000000000000000000000000000000000000",
  "generated_at": "2024-01-01T00:00:00Z",
  "granularity": "file",
  "nodes": [
    {
      "node_id": "file:a.py",
      "kind": "file",
      "path": "a.py",
      "repo": "",
      "language": "python",
      "layer": "unknown",
      "is_test": false,
      "size_bytes": 102
    },
    {
      "node_id": "file:b.py",
      "kind": "file",
      "path": "b.py",
      "repo": "",
      "language": "python",
      "layer": "unknown",
      "is_test": false,
      "size_bytes": 48
    },
    {
      "node_id": "file:c.py",
      "kind": "file",
      "path": "c.py",
      "repo": "",
      "language": "python",
      "layer": "unknown",
      "is_test": false,
      "size_bytes": 44
    },
    {
      "node_id": "file:foo_test.py",
      "kind": "file",
      "path": "foo_test.py",
      "repo": "",
      "language": "python",
      "layer": "unknown",
      "is_test": true,
      "size_bytes": 9
    },
    {
      "node_id": "file:pkg/__init__.py",
      "kind": "file",
      "path": "pkg/__init__.py",
      "repo": "",
      "language": "python",
      "layer": "unknown",
      "is_test": false,
      "size_bytes": 79
    },
    {
      "node_id": "file:pkg/submodule.py",
      "kind": "file",
      "path": "pkg/submodule.py",
      "repo": "",
      "language": "python",
      "layer": "unknown",
      "is_test": false,
      "size_bytes": 20
    },
    {
      "node_id": "file:sub/__init__.py",
      "kind": "file",
      "path": "sub/__init__.py",
      "repo": "",
      "language": "python",
      "layer": "unknown",
      "is_test": false,
      "size_bytes": 17
    },
    {
      "node_id": "file:sub/x.py",
      "kind": "file",
      "path": "sub/x.py",
      "repo": "",
      "language": "python",
      "layer": "unknown",
      "is_test": false,
      "size_bytes": 18
    },
    {
      "node_id": "module:c",
      "kind": "external",
      "path": "",
      "repo": "",
      "language": "python",
      "layer": "unknown",
      "is_test": false,
      "size_bytes": 0
    },
    {
      "node_id": "module:json",
      "kind": "external",
      "path": "",
      "repo": "",
      "language": "python",
      "layer": "unknown",
      "is_test": false,
      "size_bytes": 0
    },
    {
      "node_id": "module:logging",
      "kind": "external",
      "path": "",
      "repo": "",
      "language": "python",
      "layer": "unknown",
      "is_test": false,
      "size_bytes": 0
    },
    {
      "node_id": "module:os",
      "kind": "external",
      "path": "",
      "repo": "",
      "language": "python",
      "layer": "unknown",
      "is_test": false,
      "size_bytes": 0
    },
    {
      "node_id": "module:os.path",
      "kind": "external",
      "path": "",
      "repo": "",
      "language": "python",
      "layer": "unknown",
      "is_test": false,
      "size_bytes": 0
    },
    {
      "node_id": "module:pkg",
      "kind": "external",
      "path": "",
      "repo": "",
      "language": "python",
      "layer": "unknown",
      "is_test": false,
      "size_bytes": 0
    },
    {
      "node_id": "module:pkg.submodule",
      "kind": "external",
      "path": "",
      "repo": "",
      "language": "python",
      "layer": "unknown",
      "is_test": false,
      "size_bytes": 0
    },
    {
      "node_id": "module:sub",
      "kind": "external",
      "path": "",
      "repo": "",
      "language": "python",
      "layer": "unknown",
      "is_test": false,
      "size_bytes": 0
    },
    {
      "node_id": "module:sys",
      "kind": "external",
      "path": "",
      "repo": "",
      "language": "python",
      "layer": "unknown",
      "is_test": false,
      "size_bytes": 0
    },
    {
      "node_id": "module:typing",
      "kind": "external",
      "path": "",
      "repo": "",
      "language": "python",
      "layer": "unknown",
      "is_test": false,
      "size_bytes": 0
    },
    {
      "node_id": "module:typing.List",
      "kind": "external",
      "path": "",
      "repo": "",
      "language": "python",
      "layer": "unknown",
      "is_test": false,
      "size_bytes": 0
    }
  ],
  "edges": [
    {
      "src": "file:a.py",
      "dst": "file:b.py",
      "edge_type": "import",
      "evidence_level": "S1",
      "evidence": {
        "source_path": "a.py",
        "start_line": 3,
        "end_line": 3
      }
    },
    {
      "src": "file:a.py",
      "dst": "module:os",
      "edge_type": "import",
      "evidence_level": "S1",
      "evidence": {
        "source_path": "a.py",
        "start_line": 1,
        "end_line": 1
      }
    },
    {
      "src": "file:a.py",
      "dst": "module:os",
      "edge_type": "import",
      "evidence_level": "S1",
      "evidence": {
        "source_path": "a.py",
        "start_line": 4,
        "end_line": 4
      }
    },
    {
      "src": "file:a.py",
      "dst": "module:os.path",
      "edge_type": "import",
      "evidence_level": "S1",
      "evidence": {
        "source_path": "a.py",
        "start_line": 4,
        "end_line": 4
      }
    },
    {
      "src": "file:a.py",
      "dst": "module:sys",
      "edge_type": "import",
      "evidence_level": "S1",
      "evidence": {
        "source_path": "a.py",
        "start_line": 2,
        "end_line": 2
      }
    },
    {
      "src": "file:a.py",
      "dst": "module:typing",
      "edge_type": "import",
      "evidence_level": "S1",
      "evidence": {
        "source_path": "a.py",
        "start_line": 5,
        "end_line": 5
      }
    },
    {
      "src": "file:a.py",
      "dst": "module:typing.List",
      "edge_type": "import",
      "evidence_level": "S1",
      "evidence": {
        "source_path": "a.py",
        "start_line": 5,
        "end_line": 5
      }
    },
    {
      "src": "file:b.py",
      "dst": "module:json",
      "edge_type": "import",
      "evidence_level": "S1",
      "evidence": {
        "source_path": "b.py",
        "start_line": 1,
        "end_line": 1
      }
    },
    {
      "src": "file:b.py",
      "dst": "module:logging",
      "edge_type": "import",
      "evidence_level": "S1",
      "evidence": {
        "source_path": "b.py",
        "start_line": 2,
        "end_line": 2
      }
    },
    {
      "src": "file:c.py",
      "dst": "module:pkg",
      "edge_type": "import",
      "evidence_level": "S1",
      "evidence": {
        "source_path": "c.py",
        "start_line": 1,
        "end_line": 1
      }
    },
    {
      "src": "file:c.py",
      "dst": "module:pkg.submodule",
      "edge_type": "import",
      "evidence_level": "S1",
      "evidence": {
        "source_path": "c.py",
        "start_line": 1,
        "end_line": 1
      }
    },
    {
      "src": "file:c.py",
      "dst": "module:sub",
      "edge_type": "import",
      "evidence_level": "S1",
      "evidence": {
        "source_path": "c.py",
        "start_line": 2,
        "end_line": 2
      }
    },
    {
      "src": "file:foo_test.py",
      "dst": "module:c",
      "edge_type": "import",
      "evidence_level": "S1",
      "evidence": {
        "source_path": "foo_test.py",
        "start_line": 1,
        "end_line": 1
      }
    },
    {
      "src": "file:pkg/__init__.py",
      "dst": "file:pkg/submodule.py",
      "edge_type": "import",
      "evidence_level": "S1",
      "evidence": {
        "source_path": "pkg/__init__.py",
        "start_line": 1,
        "end_line": 1
      }
    },
    {
      "src": "file:pkg/__init__.py",
      "dst": "file:pkg/submodule.py",
      "edge_type": "import",
      "evidence_level": "S1",
      "evidence": {
        "source_path": "pkg/__init__.py",
        "start_line": 2,
        "end_line": 2
      }
    },
    {
      "src": "file:pkg/__init__.py",
      "dst": "file:pkg/submodule.py",
      "edge_type": "import",
      "evidence_level": "S1",
      "evidence": {
        "source_path": "pkg/__init__.py",
        "start_line": 3,
        "end_line": 3
      }
    },
    {
      "src": "file:sub/__init__.py",
      "dst": "file:sub/x.py",
      "edge_type": "import",
      "evidence_level": "S1",
      "evidence": {
        "source_path": "sub/__init__.py",
        "start_line": 1,
        "end_line": 1
      }
    }
  ],
  "coverage": {
    "files_seen": 8,
    "files_parsed": 8,
    "edge_counts_by_type": {
      "import": 17
    },
    "unknown_layer_share": 1.0
  }
}